{
  "schemaVersion": "1.0",
  "id": "deck",
  "type": "deck",
  "title": "Design Studio 소개 덱",
  "canvas": {
    "width": 1920,
    "height": 1080,
    "safeArea": { "top": 60, "right": 96, "bottom": 80, "left": 96 }
  },
  "slides": [
    {
      "id": "cover",
      "layout": "title",
      "title": "표지",
      "blocks": [
        {
          "id": "cover-eyebrow",
          "kind": "caption",
          "text": "P0 · 기반 구조",
          "box": { "x": 160, "y": 360, "w": 600, "h": 40 },
          "style": { "fontSize": 24, "weight": 500, "color": "accent", "lineHeight": 1.4 }
        },
        {
          "id": "cover-title",
          "kind": "heading",
          "text": "하나의 매니페스트,\n세 가지 산출물",
          "box": { "x": 160, "y": 424, "w": 1400, "h": 260 },
          "style": { "fontRole": "display", "fontSize": 96, "weight": 800, "color": "fg", "lineHeight": 1.2 }
        },
        {
          "id": "cover-sub",
          "kind": "body",
          "text": "Design Studio 프로젝트 매니페스트와 통합 CLI",
          "box": { "x": 160, "y": 712, "w": 1200, "h": 60 },
          "style": { "fontSize": 32, "color": "muted", "lineHeight": 1.5 }
        }
      ],
      "notes": "표지에서는 제품 이름보다 '무엇이 달라지는가'를 먼저 말한다.",
      "transition": "fade"
    },
    {
      "id": "problem",
      "layout": "statement",
      "title": "문제",
      "blocks": [
        {
          "id": "problem-text",
          "kind": "heading",
          "text": "산출물이 늘어날수록\n근거가 흩어진다",
          "box": { "x": 160, "y": 380, "w": 1400, "h": 280 },
          "style": { "fontRole": "display", "fontSize": 80, "weight": 800, "color": "fg", "lineHeight": 1.25 }
        },
        {
          "id": "problem-sub",
          "kind": "body",
          "text": "같은 브랜드로 웹·덱·영상을 만들었는데 색이 다르고, 수치의 출처가 다르고, 어떤 방향으로 합의했는지 아무도 기억하지 못한다.",
          "box": { "x": 160, "y": 700, "w": 1040, "h": 120 },
          "style": { "fontSize": 28, "color": "muted", "lineHeight": 1.6 }
        }
      ],
      "notes": "청중이 자기 경험으로 알아듣는 지점. 도구 설명은 아직 하지 않는다."
    },
    {
      "id": "approach",
      "layout": "bullets",
      "title": "접근",
      "blocks": [
        {
          "id": "approach-title",
          "kind": "subheading",
          "text": "매니페스트가 먼저, 편집기는 그 위에",
          "box": { "x": 160, "y": 180, "w": 1500, "h": 90 },
          "style": { "fontRole": "display", "fontSize": 56, "weight": 600, "color": "fg", "lineHeight": 1.3 }
        },
        {
          "id": "approach-list",
          "kind": "bullets",
          "items": [
            "공통 매니페스트에 브랜드 토큰·자산 출처·승인을 모은다",
            "산출물마다 고유 구조는 IR로 분리한다",
            "승인 게이트를 통과해야 렌더가 시작된다",
            "검수 실패는 종료 코드로 드러난다"
          ],
          "box": { "x": 160, "y": 340, "w": 1260, "h": 400 },
          "style": { "fontSize": 36, "color": "fg", "lineHeight": 1.9 }
        },
        {
          "id": "approach-note",
          "kind": "caption",
          "text": "시각 편집기를 먼저 만들면 화면 상태와 생성 코드가 어긋난다.",
          "box": { "x": 160, "y": 800, "w": 1300, "h": 60 },
          "style": { "fontSize": 24, "color": "muted", "lineHeight": 1.5 },
          "claims": [
            {
              "text": "시각 편집기를 먼저 만들면 화면 상태와 생성 코드가 어긋난다",
              "sourceId": "src-roadmap",
              "kind": "claim",
              "locator": "6장 권장 구현 순서"
            }
          ]
        }
      ],
      "notes": "여기서 '왜 이 순서인가'를 설명한다. 순서를 바꾸면 무엇이 깨지는지까지."
    },
    {
      "id": "scope",
      "layout": "kpi",
      "title": "조사 범위",
      "blocks": [
        {
          "id": "scope-title",
          "kind": "subheading",
          "text": "조사한 저장소",
          "box": { "x": 160, "y": 200, "w": 1500, "h": 90 },
          "style": { "fontRole": "display", "fontSize": 56, "weight": 600, "color": "fg" }
        },
        {
          "id": "scope-number",
          "kind": "kpi",
          "text": "11",
          "items": ["비교 분석한 GitHub 공개 저장소"],
          "box": { "x": 160, "y": 360, "w": 700, "h": 300 },
          "style": { "fontRole": "display", "fontSize": 200, "weight": 800, "color": "accent", "lineHeight": 1.1 },
          "claims": [
            {
              "text": "조사 범위: GitHub 공개 저장소 11개와 현재 디자인 스튜디오 코드·문서",
              "sourceId": "src-roadmap",
              "kind": "quote",
              "locator": "머리말"
            }
          ]
        },
        {
          "id": "scope-body",
          "kind": "body",
          "text": "스킬 패키징, 레퍼런스 잠금, Design-as-Code, 지속 프로젝트, 출처 추적, 결정론적 영상 렌더, 시각 편집까지 축이 겹치는 프로젝트만 골라 비교했다.",
          "box": { "x": 960, "y": 380, "w": 800, "h": 300 },
          "style": { "fontSize": 30, "color": "muted", "lineHeight": 1.7 }
        }
      ],
      "notes": "숫자 하나만 크게. 나머지는 옆에서 조용히 받쳐준다."
    },
    {
      "id": "closing",
      "layout": "closing",
      "title": "마무리",
      "blocks": [
        {
          "id": "closing-text",
          "kind": "heading",
          "text": "검수를 통과하지 못하면\n성공으로 끝나지 않는다",
          "box": { "x": 160, "y": 420, "w": 1500, "h": 240 },
          "style": { "fontRole": "display", "fontSize": 72, "weight": 800, "color": "fg", "lineHeight": 1.3 }
        },
        {
          "id": "closing-cmd",
          "kind": "code",
          "text": "design check --strict",
          "box": { "x": 160, "y": 720, "w": 700, "h": 80 },
          "style": { "fontRole": "mono", "fontSize": 32, "color": "accent", "lineHeight": 1.5 }
        }
      ],
      "notes": "마지막은 명령 한 줄로 닫는다. 청중이 바로 따라 칠 수 있게."
    }
  ]
}
