{
  "schemaVersion": "1.0",
  "id": "site",
  "type": "html",
  "title": "Design Studio 소개 페이지",
  "pages": [
    {
      "id": "index",
      "path": "index.html",
      "title": "Design Studio — 하나의 매니페스트, 세 가지 산출물",
      "viewports": ["1440x900", "1024x768", "390x844"],
      "sections": [
        {
          "id": "hero",
          "kind": "hero",
          "blocks": [
            {
              "id": "hero-title",
              "kind": "heading",
              "text": "하나의 매니페스트에서 웹·덱·영상까지",
              "style": {
                "fontRole": "display",
                "fontSize": 64,
                "weight": 800,
                "color": "fg",
                "lineHeight": 1.15
              }
            },
            {
              "id": "hero-sub",
              "kind": "body",
              "text": "브랜드 토큰, 자산 출처, 승인 기록을 한 파일에 모아두면 산출물이 늘어나도 같은 근거 위에서 만들어진다. Design Studio는 그 파일을 design-project.json이라고 부른다.",
              "style": { "fontSize": 20, "color": "muted", "lineHeight": 1.7 }
            }
          ]
        },
        {
          "id": "why",
          "kind": "feature",
          "blocks": [
            {
              "id": "why-title",
              "kind": "subheading",
              "text": "왜 매니페스트가 먼저인가",
              "style": { "fontRole": "display", "fontSize": 36, "weight": 600, "color": "fg", "lineHeight": 1.3 }
            },
            {
              "id": "why-body",
              "kind": "body",
              "text": "시각 편집기를 먼저 만들면 화면 상태와 생성 코드가 어긋난다. 프로젝트 상태와 IR을 먼저 정의한 뒤 그 위에 편집기를 올려야 한다.",
              "style": { "fontSize": 18, "color": "muted", "lineHeight": 1.7 },
              "claims": [
                {
                  "text": "시각 편집기를 먼저 만들면 화면 상태와 생성 코드가 어긋난다",
                  "sourceId": "src-roadmap",
                  "kind": "claim",
                  "locator": "6장 권장 구현 순서"
                }
              ]
            },
            {
              "id": "why-list",
              "kind": "bullets",
              "items": [
                "브랜드 토큰과 자산 출처가 산출물마다 흩어지지 않는다",
                "중단한 자리에서 design resume으로 이어갈 수 있다",
                "변경되지 않은 입력은 다시 처리하지 않는다",
                "검수에 실패하면 명령이 성공으로 끝나지 않는다"
              ],
              "style": { "fontSize": 18, "color": "fg", "lineHeight": 1.8 }
            }
          ]
        },
        {
          "id": "scope",
          "kind": "content",
          "blocks": [
            {
              "id": "scope-title",
              "kind": "subheading",
              "text": "어디까지 조사했나",
              "style": { "fontRole": "display", "fontSize": 36, "weight": 600, "color": "fg", "lineHeight": 1.3 }
            },
            {
              "id": "scope-kpi",
              "kind": "kpi",
              "text": "11개",
              "items": ["비교 분석한 GitHub 공개 저장소"],
              "style": { "fontRole": "display", "fontSize": 72, "weight": 800, "color": "accent", "lineHeight": 1.1 },
              "claims": [
                {
                  "text": "조사 범위: GitHub 공개 저장소 11개와 현재 디자인 스튜디오 코드·문서",
                  "sourceId": "src-roadmap",
                  "kind": "quote",
                  "locator": "머리말"
                }
              ]
            },
            {
              "id": "scope-table",
              "kind": "table",
              "data": [
                ["단계", "명령", "막는 것"],
                ["구조", "design plan / build", "스키마를 벗어난 IR"],
                ["근거", "design approve", "방향 확인 없는 제작"],
                ["검수", "design check", "출처 없는 수치와 대비 미달"],
                ["산출", "design render / export", "승인 없이 시작하는 렌더"]
              ],
              "style": { "fontSize": 16, "color": "fg", "lineHeight": 1.6 }
            }
          ]
        },
        {
          "id": "footer",
          "kind": "footer",
          "blocks": [
            {
              "id": "footer-text",
              "kind": "caption",
              "text": "이 페이지는 design render가 ir/site.json에서 생성했다. 같은 매니페스트가 덱과 영상도 만든다.",
              "style": { "fontSize": 14, "color": "muted", "lineHeight": 1.6 }
            }
          ]
        }
      ]
    }
  ]
}
